{
  "schema_version": 2,
  "adapter_version": 1,
  "provenance": {
    "module_id": "avm-res-insights-datacollectionendpoint",
    "source_sha": "f5616363cc0985e71083ce3e6d33af8a7d6d04e3",
    "cli_version": "0.1.0",
    "cli_commit": "c9d714fd6cb7da88ffcb4b049f39480263cc2875",
    "adapter_version": 1
  },
  "ruleset_name": "avm-intelligence-offline",
  "ruleset_digest": "55b982d670cb1e5d1e4381b5d4276ea46e553065e75ab72fb49b342e4b3b7da1",
  "source_digest": "74d5644605aba090568dcfb4fb230c70292bb587bc94df00f5c5b45f2a21b0fe",
  "units": [
    {
      "path": ".",
      "role": "component",
      "classification": {
        "kind": "unknown",
        "method": "unavailable",
        "reason": "Jev not run; set a path override or --kind if known"
      },
      "checks": [
        {
          "id": "input-descriptions",
          "engine": "go",
          "status": "unchecked",
          "severity": "warning",
          "message": "code kind unresolved; Reusable module inputs should have nonempty descriptions."
        },
        {
          "id": "output-descriptions",
          "engine": "go",
          "status": "unchecked",
          "severity": "warning",
          "message": "code kind unresolved; Reusable module outputs should have nonempty descriptions."
        },
        {
          "id": "module-state-is-caller-owned",
          "engine": "go",
          "status": "unchecked",
          "severity": "error",
          "message": "code kind unresolved; State backend belongs in the deployment entry point."
        },
        {
          "id": "module-cloud-is-caller-owned",
          "engine": "go",
          "status": "unchecked",
          "severity": "error",
          "message": "code kind unresolved; Cloud workspace configuration belongs in the deployment entry point."
        },
        {
          "id": "deployment-core-version",
          "engine": "go",
          "status": "unchecked",
          "severity": "warning",
          "message": "code kind unresolved; Declare the Terraform core version supported by this deployment."
        },
        {
          "id": "declared-provider-sources",
          "engine": "go",
          "status": "pass",
          "severity": "warning",
          "message": "Declare provider requirements explicitly when providers are used; customize for provider-free configurations.",
          "evidence": [
            "terraform.tf:4"
          ]
        }
      ],
      "symbol_count": 34
    },
    {
      "path": "examples/default",
      "role": "example",
      "owner": ".",
      "owner_scope": "component",
      "classification": {
        "kind": "unknown",
        "method": "unavailable",
        "reason": "Jev not run; set a path override or --kind if known"
      },
      "checks": [
        {
          "id": "input-descriptions",
          "engine": "go",
          "status": "unchecked",
          "severity": "warning",
          "message": "code kind unresolved; Reusable module inputs should have nonempty descriptions."
        },
        {
          "id": "output-descriptions",
          "engine": "go",
          "status": "unchecked",
          "severity": "warning",
          "message": "code kind unresolved; Reusable module outputs should have nonempty descriptions."
        },
        {
          "id": "module-state-is-caller-owned",
          "engine": "go",
          "status": "unchecked",
          "severity": "error",
          "message": "code kind unresolved; State backend belongs in the deployment entry point."
        },
        {
          "id": "module-cloud-is-caller-owned",
          "engine": "go",
          "status": "unchecked",
          "severity": "error",
          "message": "code kind unresolved; Cloud workspace configuration belongs in the deployment entry point."
        },
        {
          "id": "deployment-core-version",
          "engine": "go",
          "status": "unchecked",
          "severity": "warning",
          "message": "code kind unresolved; Declare the Terraform core version supported by this deployment."
        },
        {
          "id": "declared-provider-sources",
          "engine": "go",
          "status": "pass",
          "severity": "warning",
          "message": "Declare provider requirements explicitly when providers are used; customize for provider-free configurations.",
          "evidence": [
            "examples/default/main.tf:4"
          ]
        }
      ],
      "symbol_count": 6
    }
  ]
}
